Date,Title,Link,Matched Terms,Inline Links
2025-12-25,Fortinet Warns of Active Exploitation of FortiOS SSL VPN 2FA Bypass Vulnerability,https://thehackernews.com/2025/12/fortinet-warns-of-active-exploitation.html,CVE-2020-12812,
2025-12-25,CISA Flags Actively Exploited Digiever NVR Vulnerability Allowing Remote Code Execution,https://thehackernews.com/2025/12/cisa-flags-actively-exploited-digiever.html,CVE-2023-52163,
2025-12-19,Russia-Linked Hackers Use Microsoft 365 Device Code Phishing for Account Takeovers,https://thehackernews.com/2025/12/russia-linked-hackers-use-microsoft-365.html,Phish,
2025-12-19,WatchGuard Warns of Active Exploitation of Critical Fireware OS VPN Vulnerability,https://thehackernews.com/2025/12/watchguard-warns-of-active-exploitation.html,CVE-2025-14733,
2025-12-19,Nigeria Arrests RaccoonO365 Phishing Developer Linked to Microsoft 365 Attacks,https://thehackernews.com/2025/12/nigeria-arrests-raccoono365-phishing.html,Phish,
2025-12-18,HPE OneView Flaw Rated CVSS 10.0 Allows Unauthenticated Remote Code Execution,https://thehackernews.com/2025/12/hpe-oneview-flaw-rated-cvss-100-allows.html,critical Vulnerability,
2025-12-18,"ThreatsDay Bulletin: WhatsApp Hijacks, MCP Leaks, AI Recon, React2Shell Exploit and 15 More Stories",https://thehackernews.com/2025/12/threatsday-bulletin-whatsapp-hijacks.html,"React2shell, react",
2025-12-18,The Case for Dynamic AI-SaaS Security as Copilots Scale,https://thehackernews.com/2025/12/the-case-for-dynamic-ai-saas-security.html,Salesforce,
2025-12-18,Kimsuky Spreads DocSwap Android Malware via QR Phishing Posing as Delivery App,https://thehackernews.com/2025/12/kimsuky-spreads-docswap-android-malware.html,Phish,
2025-12-18,CISA Flags Critical ASUS Live Update Flaw After Evidence of Active Exploitation,https://thehackernews.com/2025/12/cisa-flags-critical-asus-live-update.html,CVE-2025-59374,
2025-12-17,SonicWall Fixes Actively Exploited CVE-2025-40602 in SMA 100 Appliances,https://thehackernews.com/2025/12/sonicwall-fixes-actively-exploited-cve.html,"sonicwall, CVE-2025-40602",
2025-12-17,APT28 Targets Ukrainian UKR-net Users in Long-Running Credential Phishing Campaign,https://thehackernews.com/2025/12/apt28-targets-ukrainian-ukr-net-users.html,Phish,
2025-12-17,New ForumTroll Phishing Attacks Target Russian Scholars Using Fake eLibrary Emails,https://thehackernews.com/2025/12/new-forumtroll-phishing-attacks-target.html,Phish,
2025-12-17,Fix SOC Blind Spots: See Threats to Your Industry & Country in Real Time,https://thehackernews.com/2025/12/fix-soc-blind-spots-see-threats-to-your.html,react,
2025-12-16,Fortinet FortiGate Under Active Attack Through SAML SSO Authentication Bypass,https://thehackernews.com/2025/12/fortinet-fortigate-under-active-attack.html,CVE-2025-59718,
2025-12-25,Fortinet Warns of Active Exploitation of FortiOS SSL VPN 2FA Bypass Vulnerability,https://thehackernews.com/2025/12/fortinet-warns-of-active-exploitation.html,CVE-2020-12812,
2025-12-25,CISA Flags Actively Exploited Digiever NVR Vulnerability Allowing Remote Code Execution,https://thehackernews.com/2025/12/cisa-flags-actively-exploited-digiever.html,CVE-2023-52163,
2025-12-19,Russia-Linked Hackers Use Microsoft 365 Device Code Phishing for Account Takeovers,https://thehackernews.com/2025/12/russia-linked-hackers-use-microsoft-365.html,Phish,
2025-12-19,WatchGuard Warns of Active Exploitation of Critical Fireware OS VPN Vulnerability,https://thehackernews.com/2025/12/watchguard-warns-of-active-exploitation.html,CVE-2025-14733,
2025-12-19,Nigeria Arrests RaccoonO365 Phishing Developer Linked to Microsoft 365 Attacks,https://thehackernews.com/2025/12/nigeria-arrests-raccoono365-phishing.html,Phish,
2025-12-18,HPE OneView Flaw Rated CVSS 10.0 Allows Unauthenticated Remote Code Execution,https://thehackernews.com/2025/12/hpe-oneview-flaw-rated-cvss-100-allows.html,critical Vulnerability,
2025-12-18,"ThreatsDay Bulletin: WhatsApp Hijacks, MCP Leaks, AI Recon, React2Shell Exploit and 15 More Stories",https://thehackernews.com/2025/12/threatsday-bulletin-whatsapp-hijacks.html,"React2shell, react",
2025-12-18,The Case for Dynamic AI-SaaS Security as Copilots Scale,https://thehackernews.com/2025/12/the-case-for-dynamic-ai-saas-security.html,Salesforce,
2025-12-18,Kimsuky Spreads DocSwap Android Malware via QR Phishing Posing as Delivery App,https://thehackernews.com/2025/12/kimsuky-spreads-docswap-android-malware.html,Phish,
2025-12-18,CISA Flags Critical ASUS Live Update Flaw After Evidence of Active Exploitation,https://thehackernews.com/2025/12/cisa-flags-critical-asus-live-update.html,CVE-2025-59374,
2025-12-17,SonicWall Fixes Actively Exploited CVE-2025-40602 in SMA 100 Appliances,https://thehackernews.com/2025/12/sonicwall-fixes-actively-exploited-cve.html,"sonicwall, CVE-2025-40602",
2025-12-17,APT28 Targets Ukrainian UKR-net Users in Long-Running Credential Phishing Campaign,https://thehackernews.com/2025/12/apt28-targets-ukrainian-ukr-net-users.html,Phish,
2025-12-17,New ForumTroll Phishing Attacks Target Russian Scholars Using Fake eLibrary Emails,https://thehackernews.com/2025/12/new-forumtroll-phishing-attacks-target.html,Phish,
2025-12-17,Fix SOC Blind Spots: See Threats to Your Industry & Country in Real Time,https://thehackernews.com/2025/12/fix-soc-blind-spots-see-threats-to-your.html,react,
2025-12-16,Fortinet FortiGate Under Active Attack Through SAML SSO Authentication Bypass,https://thehackernews.com/2025/12/fortinet-fortigate-under-active-attack.html,CVE-2025-59718,
2025-12-09,"Microsoft Patch Tuesday, December 2025 Edition",https://krebsonsecurity.com/2025/12/microsoft-patch-tuesday-december-2025-edition/,"CVE-2025-62221, cve-2025-62221",CVE-2025-62221->https://msrc.microsoft.com/update-guide/vulnerability/CVE-2025-62221
2025-12-04,"SMS Phishers Pivot to Points, Taxes, Fake Retailers",https://krebsonsecurity.com/2025/12/sms-phishers-pivot-to-points-taxes-fake-retailers/,Phish,
2025-12-18,SonicWall Edge Access Devices Hit by Zero-Day Attacks,https://www.darkreading.com/vulnerabilities-threats/sonicwall-edge-devices-zero-day-attacks,"critical Vulnerability, sonicwall",
2025-12-17,'Fake Proof' and AI Slop Hobble Defenders,https://www.darkreading.com/application-security/fake-proof-ai-slop-hobble-defenders,"React2shell, react",
2025-12-12,React2Shell Exploits Flood the Internet as Attacks Continue,https://www.darkreading.com/threat-intelligence/react2shell-exploits-flood-internet-attacks-continue,"React2shell, react, CVE-2025-55182",
2025-12-23,Feds Seize Password Database Used in Massive Bank Account Takeover Scheme,https://www.securityweek.com/feds-seize-password-database-used-in-massive-bank-account-takeover-scheme/,Phish,
2025-12-23,3.5 Million Affected by University of Phoenix Data Breach,https://www.securityweek.com/3-5-million-affected-by-university-of-phoenix-data-breach/,CL0P,
2025-12-26,Trust Wallet warns users to update Chrome extension after $7M security loss,https://securityaffairs.com/186163/cyber-crime/trust-wallet-warns-users-to-update-chrome-extension-after-7m-security-loss.html,Phish,
2025-12-26,Aflac confirms June data breach affecting over 22 million customers,https://securityaffairs.com/186144/data-breach/aflac-confirms-june-data-breach-affecting-over-22-million-customers.html,scattered spider,Scattered Spider->https://securityaffairs.com/176323/cyber-crime/scattered-spider-cybercrime-group-member-pleaded-guilty.html
2025-12-25,Five-year-old Fortinet FortiOS SSL VPN vulnerability actively exploited,https://securityaffairs.com/186117/security/five-year-old-fortinet-fortios-ssl-vpn-flaw-actively-exploited.html,"CVE-2018-13379, CVE-2019-5591, CVE-2020-12812, cve-2020-12812, cve-2018-13379, cve-2019-5591",CVE-2020-12812->https://securityaffairs.com/tag/cve-2020-12812 | CVE-2018-13379->https://securityaffairs.co/wordpress/124683/apt/iran-linked-apt-groups.html | CVE-2019-5591->https://securityaffairs.co/wordpress/120644/hacking/top-routinely-flaws-exploited.html | CVE-2020-12812->https://securityaffairs.co/wordpress/116274/hacking/fortinet-fortios-attack.html
2025-12-24,FBI seized ‘web3adspanels.org’ hosting stolen logins,https://securityaffairs.com/186094/cyber-crime/fbi-seized-web3adspanels-org-hosting-stolen-logins.html,Phish,
2025-12-23,Clop Ransomware Group Linked to 3.5m University of Phoenix Breach,https://www.infosecurity-magazine.com/news/university-phoenix-breach-clop/,CLOP,
2025-12-12,Exploitation of Critical Vulnerability in React Server Components (Updated December 12),https://unit42.paloaltonetworks.com/cve-2025-55182-react-and-cve-2025-66478-next/,"critical Vulnerability, react, CVE-2025-55182, critical vulnerability",Exploitation of Critical Vulnerability in React Server Components (Updated December 12)->https://unit42.paloaltonetworks.com/cve-2025-55182-react-and-cve-2025-66478-next/ | Exploitation of Critical Vulnerability in React Server Components (Updated December 12)->https://unit42.paloaltonetworks.com/cve-2025-55182-react-and-cve-2025-66478-next/
2025-12-25,Threat landscape for industrial automation systems in Q3 2025,https://securelist.com/industrial-threat-report-q3-2025/118602/,"Phish, CVE-2017-11882",
2025-12-24,Evasive Panda APT poisons DNS requests to deliver MgBot,https://securelist.com/evasive-panda-apt/118576/,"CLOP, Phish",
2025-12-23,Assessing SIEM effectiveness,https://securelist.com/siem-effectiveness-assessment/118560/,IOC,
2025-12-23,From cheats to exploits: Webrat spreading via GitHub,https://securelist.com/webrat-distributed-via-github/118555/,"critical Vulnerability, CVE-2025-59230, cve-2025-59230",https://github[.]com/stalker110119/CVE-2025-59230/tree/main->https://opentip.kaspersky.com/https%3a%2f%2fgithub.com%2fstalker110119%2fcve-2025-59230%2ftree%2fmain/?icid=gl_sl_opentip-lnk_sm-team_4ec0a4afcc86f99c&utm_source=SL&utm_medium=SL&utm_campaign=SL | https://github[.]com/moegameka/CVE-2025-59230->https://opentip.kaspersky.com/https%3a%2f%2fgithub.com%2fmoegameka%2fcve-2025-59230/?icid=gl_sl_opentip-lnk_sm-team_4afc130e5f08a78c&utm_source=SL&utm_medium=SL&utm_campaign=SL
2025-12-19,Cloud Atlas activity in the first half of 2025: what changed,https://securelist.com/cloud-atlas-h1-2025-campaign/118517/,"Phish, CVE-2018-0802, cve-2018-0802",CVE-2018-0802->https://www.cve.org/CVERecord?id=CVE-2018-0802
2025-12-19,Yet another DCOM object for lateral movement,https://securelist.com/lateral-movement-via-dcom-abusing-control-panel/118232/,Phish,
2025-12-17,Operation ForumTroll continues: Russian political scientists targeted using plagiarism reports,https://securelist.com/operation-forumtroll-new-targeted-campaign/118492/,"Phish, CVE-2025-2783",
2025-12-15,Frogblight threatens you with a court case: a new Android banker targets Turkish users,https://securelist.com/frogblight-banker/118440/,Phish,
2025-12-12,Following the digital trail: what happens to data stolen in a phishing attack,https://securelist.com/what-happens-to-stolen-data-after-phishing-attacks/118180/,"Phish, phish",phishing kit->https://securelist.com/phishing-kit-market-whats-inside-off-the-shelf-phishing-packages/106149/
2025-12-22,22nd December – Threat Intelligence Report,https://research.checkpoint.com/2025/22nd-december-threat-intelligence-report/,"Mark’s, OpenAI, Phish, CVE-2025-59718, CVE-2025-14733",
2025-12-17,GachiLoader: Defeating Node.js Malware with API Tracing,https://research.checkpoint.com/2025/gachiloader-node-js-malware-with-api-tracing/,IOC,
2025-12-16,Inside Ink Dragon: Revealing the Relay Network and Inner Workings of a Stealthy Offensive Operation,https://research.checkpoint.com/2025/ink-dragons-relay-network-and-offensive-operation/,"IOC, CVE-2025-49704, CVE-2025-49706, CVE-2025-53770",
2025-12-15,15th December – Threat Intelligence Report,https://research.checkpoint.com/2025/15th-december-threat-intelligence-report/,"Canadian, Phish, CVE-2025-14174, CVE-2025-43529",
2025-12-10,Cracking ValleyRAT: From Builder Secrets to Kernel Rootkits,https://research.checkpoint.com/2025/cracking-valleyrat-from-builder-secrets-to-kernel-rootkits/,"IOC, ioc",https://github.com/antonioCoco/MalSeclogon->https://github.com/antonioCoco/MalSeclogon
2025-12-08,8th December – Threat Intelligence Report,https://research.checkpoint.com/2025/8th-december-threat-intelligence-report/,"Canadian, akira, qilin, CL0P, CLOP, OpenAI, React2shell, react, sonicwall, CVE-2025-49704, CVE-2025-49706, CVE-2025-55182",
2025-12-01,CVE-2025-61260 — OpenAI Codex CLI: Command Injection via Project-Local Configuration,https://research.checkpoint.com/2025/openai-codex-cli-command-injection-vulnerability/,"OpenAI, openai",CVE-2025-61260 — OpenAI Codex CLI: Command Injection via Project-Local Configuration->https://research.checkpoint.com/2025/openai-codex-cli-command-injection-vulnerability/ | CVE-2025-61260 — OpenAI Codex CLI: Command Injection via Project-Local Configuration->https://research.checkpoint.com/2025/openai-codex-cli-command-injection-vulnerability/
2025-12-01,1st December – Threat Intelligence Report,https://research.checkpoint.com/2025/1st-december-threat-intelligence-report/,"CL0P, CLOP, OpenAI, Phish",
2025-12-17,ShadyPanda: The Silent Browser Takeover Threat and How Qualys TruRisk Eliminate Helps You Stop It,https://blog.qualys.com/category/product-tech,Phish,
2025-12-11,"Scale AI Securely with Qualys TotalAI’s Streamlined Onboarding, Deeper Risk Detection, and Compliance-Ready Reporting",https://blog.qualys.com/category/product-tech,OpenAI,
2025-12-11,React2Shell: Decoding CVE-2025-55182 – The Silent Threat in React Server Components,https://blog.qualys.com/category/vulnerabilities-threat-research,"critical Vulnerability, React2shell, react, CVE-2025-55182, cve-2025-55182",CVE-2025-55182->https://nvd.nist.gov/vuln/detail/CVE-2025-55182
2025-12-09,"Microsoft and Adobe Patch Tuesday, December 2025 Security Update Review",https://blog.qualys.com/category/vulnerabilities-threat-research,"CVE-2025-62221, cve-2025-62221",CVE-2025-62221: Windows Cloud Files Mini Filter Driver Elevation of Privilege Vulnerability->https://msrc.microsoft.com/update-guide/en-US/vulnerability/CVE-2025-62221
2025-12-26,"The Best, the Worst and the Ugliest in Cybersecurity | 2025 Edition",https://www.sentinelone.com/blog/the-best-the-worst-and-the-ugliest-in-cybersecurity-2025-edition/,"akira, Phish, React2shell, react, CVE-2025-12480, CVE-2025-61884, phish, react2shell",AkiraBot->https://www.sentinelone.com/blog/the-good-the-bad-and-the-ugly-in-cybersecurity-week-15-6/ | Gamma AI phishing->https://www.sentinelone.com/blog/the-good-the-bad-and-the-ugly-in-cybersecurity-week-16-6/ | React2Shell->https://www.sentinelone.com/blog/the-good-the-bad-and-the-ugly-in-cybersecurity-week-49-7/ | React2Shell->https://www.sentinelone.com/blog/the-good-the-bad-and-the-ugly-in-cybersecurity-week-49-7/
2025-12-19,"The Good, the Bad and the Ugly in Cybersecurity – Week 51",https://www.sentinelone.com/blog/the-good-the-bad-and-the-ugly-in-cybersecurity-week-51-8/,"lazarus, Phish, phish",Lazarus Group->https://www.sentinelone.com/blog/lazarus-operation-interception-targets-macos-users-dreaming-of-jobs-in-crypto/ | phishing lures->https://www.sentinelone.com/cybersecurity-101/threat-intelligence/spear-phishing-vs-phishing/
2025-12-09,"Cybersecurity 2026 | The Year Ahead in AI, Adversaries, and Global Change",https://www.sentinelone.com/blog/cybersecurity-2026-the-year-ahead-in-ai-adversaries-and-global-change/,"IOC, CL0P, Salesforce, Phish, react",
2025-12-05,From React to Remote Code – Protecting Against the Critical React2Shell RCE Exposure,https://www.sentinelone.com/blog/protecting-against-critical-react2shell-rce-exposure/,"IOC, hunting, React2shell, react, CVE-2025-55182, react2shell, cve-2025-55182",React2Shell->https://react2shell.com/ | React2Shell->https://react2shell.com/ | React->https://react.dev/ | react-server-dom-webpack->https://www.npmjs.com/package/react-server-dom-webpack | react-server-dom-parcel->https://www.npmjs.com/package/react-server-dom-parcel | react-server-dom-turbopack->http://react-server-dom-turbopack | CVE-2025-55182->https://nvd.nist.gov/vuln/detail/CVE-2025-55182 | CVE-2025-55182->https://nvd.nist.gov/vuln/detail/CVE-2025-55182 | React announcement->https://react.dev/blog/2025/12/03/critical-security-vulnerability-in-react-server-components
2025-12-05,"The Good, the Bad and the Ugly in Cybersecurity – Week 49",https://www.sentinelone.com/blog/the-good-the-bad-and-the-ugly-in-cybersecurity-week-49-7/,"lazarus, Phish, React2shell, react, CVE-2025-55182, react2shell, cve-2025-55182",#Lazarus->https://twitter.com/hashtag/Lazarus?src=hash&ref_src=twsrc%5Etfw | React2Shell->https://react2shell.com/ | React2Shell->https://react2shell.com/ | react-server-dom-webpack->https://www.npmjs.com/package/react-server-dom-webpack | react-server-dom-parcel->https://www.npmjs.com/package/react-server-dom-parcel | react-server-dom-turbopack->https://www.npmjs.com/package/react-server-dom-turbopack?activeTab=readme | CVE-2025-55182->https://nvd.nist.gov/vuln/detail/CVE-2025-55182
2025-11-28,"The Good, the Bad and the Ugly in Cybersecurity – Week 48",https://www.sentinelone.com/blog/the-good-the-bad-and-the-ugly-in-cybersecurity-week-48-7/,"OpenAI, Phish, phish",phishing->https://www.sentinelone.com/cybersecurity-101/threat-intelligence/phishing-scams/
2025-12-22,A week in security (December 15 &#8211; December 21),https://www.malwarebytes.com/blog/news/2025/12/a-week-in-security-december-15-december-21,"Phish, phish",Inside a purchase order PDF phishing campaign->https://www.malwarebytes.com/blog/threat-intel/2025/12/inside-a-purchase-order-pdf-phishing-campaign
2025-12-19,"CISA warns ASUS Live Update backdoor is still exploitable, seven years on",https://www.malwarebytes.com/blog/news/2025/12/cisa-warns-asus-live-update-backdoor-is-still-exploitable-seven-years-on,"CVE-2025-59374, cve-2025-59374",CVE-2025-59374->https://www.cve.org/CVERecord?id=CVE-2025-59374
2025-12-18,Chrome extension slurps up AI chats after users installed it for privacy,https://www.malwarebytes.com/blog/news/2025/12/chrome-extension-slurps-up-ai-chats-after-users-installed-it-for-privacy,OpenAI,
2025-12-17,Inside a purchase order PDF phishing campaign,https://www.malwarebytes.com/blog/threat-intel/2025/12/inside-a-purchase-order-pdf-phishing-campaign,Phish,
2025-12-16,"SoundCloud, Pornhub, and 700Credit all reported data breaches, but the similarities end there",https://www.malwarebytes.com/blog/news/2025/12/soundcloud-pornhub-and-700credit-all-reported-data-breaches-but-the-similarities-end-there,Phish,
2025-12-16,Android mobile adware surges in second half of 2025,https://www.malwarebytes.com/blog/mobile/2025/12/android-threats-in-2025-when-your-phone-becomes-the-main-attack-surface,Phish,
2025-12-16,Google is discontinuing its dark web report: why it matters,https://www.malwarebytes.com/blog/news/2025/12/google-is-discontinuing-its-dark-web-report-why-it-matters,"Phish, react",
2025-12-15,PayPal closes loophole that let scammers send real emails with fake purchase notices,https://www.malwarebytes.com/blog/news/2025/12/paypal-closes-loophole-that-let-scammers-send-real-emails-with-fake-purchase-notices,"Phish, react, phish",phishing@paypal.com->mailto:phishing@paypal.com
2025-12-15,A week in security (December 8 &#8211; December 14),https://www.malwarebytes.com/blog/uncategorized/2025/12/a-week-in-security-december-8-december-14,"Phish, phish",GhostFrame phishing kit fuels widespread attacks against millions->https://www.malwarebytes.com/blog/news/2025/12/ghostframe-phishing-kit-fuels-widespread-attacks-against-millions | How phishers hide banking scams behind free Cloudflare Pages->https://www.malwarebytes.com/blog/news/2025/12/how-phishers-hide-banking-scams-behind-free-cloudflare-pages
2025-12-12,The US digital doxxing of H-1B applicants is a massive privacy misstep,https://www.malwarebytes.com/blog/news/2025/12/the-us-digital-doxxing-of-h-1b-applicants-is-a-massive-privacy-misstep,Phish,
2025-12-12,Google ads funnel Mac users to poisoned AI chats that spread the AMOS infostealer,https://www.malwarebytes.com/blog/news/2025/12/google-ads-funnel-mac-users-to-poisoned-ai-chats-that-spread-the-amos-infostealer,OpenAI,
2025-12-11,DroidLock malware locks you out of your Android device and demands ransom,https://www.malwarebytes.com/blog/news/2025/12/droidlock-malware-locks-you-out-of-your-android-device-and-demands-ransom,Phish,
2025-12-18,SonicWall Edge Access Devices Hit by Zero-Day Attacks,https://www.darkreading.com/vulnerabilities-threats/sonicwall-edge-devices-zero-day-attacks,"critical Vulnerability, sonicwall",
2025-12-17,'Fake Proof' and AI Slop Hobble Defenders,https://www.darkreading.com/application-security/fake-proof-ai-slop-hobble-defenders,"React2shell, react",
2025-12-12,React2Shell Exploits Flood the Internet as Attacks Continue,https://www.darkreading.com/threat-intelligence/react2shell-exploits-flood-internet-attacks-continue,"React2shell, react, CVE-2025-55182",
2025-12-26,Daily Dose of Dark Web Informer for the 26th of December 2025,https://darkwebinformer.com/daily-dose-of-dark-web-informer-for-the-26th-of-december-2025/,IOC,
2025-12-26,Threat Attack Update for the 26th of December 2025,https://darkwebinformer.com/threat-attack-update-for-the-26th-of-december-2025/,"Canada, IOC, akira, qilin, Lockbit",
2025-12-26,Ransomware Attack Update for the 26th of December 2025,https://darkwebinformer.com/ransomware-attack-update-for-the-26th-of-december-2025/,"IOC, akira, qilin, Lockbit",
2025-12-26,Alleged sale of France mobile database containing 160 million mobile numbers,https://darkwebinformer.com/alleged-sale-of-france-mobile-database-containing-160-million-mobile-numbers/,"IOC, Phish",
2025-12-26,Alleged data breach of University of Tabuk,https://darkwebinformer.com/alleged-data-breach-of-university-of-tabuk/,IOC,
2025-12-25,Chrysler falls victim to Everest Ransomware,https://darkwebinformer.com/chrysler-falls-victim-to-everest-ransomware/,"Everest, Salesforce",
2025-12-26,Everest Ransomware Group Claims Theft of Over 1TB of Chrysler Data,https://hackread.com/everest-ransomware-group-chrysler-data-breach/,Everest,
2025-12-23,RTO Scam Wave Continues: A Surge in Browser-Based e-Challan Phishing and Shared Fraud Infrastructure,https://cyble.com/blog/rto-scam-wave-continues/,"IOC, Phish, phish",RTO Scam Wave Continues: A Surge in Browser-Based e-Challan Phishing and Shared Fraud Infrastructure->https://cyble.com/blog/rto-scam-wave-continues/
2025-12-23,"The Week in Vulnerabilities: More Than 2,000 New Flaws Emerge",https://cyble.com/blog/it-vulnerabilities-ics-record-week-new-flaws/,"critical Vulnerability, WSUS, react, CVE-2025-59287, CVE-2025-62221, CVE-2025-14174, CVE-2025-43529, CVE-2025-55182, CVE-2025-59718, cve-2025-43529, cve-2025-59718, cve-2025-55182, cve-2025-14174, cve-2025-62221, cve-2025-59287",CVE-2025-43529->https://nvd.nist.gov/vuln/detail/CVE-2025-43529 | CVE-2025-59718->https://nvd.nist.gov/vuln/detail/CVE-2025-59718 | CVE-2025-55182->https://nvd.nist.gov/vuln/detail/CVE-2025-55182 | CVE-2025-14174->https://nvd.nist.gov/vuln/detail/CVE-2025-14174 | CVE-2025-62221->https://nvd.nist.gov/vuln/detail/cve-2025-62221 | CVE-2025-59287->https://nvd.nist.gov/vuln/detail/CVE-2025-59287
2025-12-19,Stealth in Layers: Unmasking the Loader used in Targeted Email Campaigns,https://cyble.com/blog/stealth-in-layers-unmasking-loader-in-targeted-email-campaigns/,"IOC, Phish, CVE-2017-11882, cve-2017-11882",CVE-2017-11882->https://nvd.nist.gov/vuln/detail/cve-2017-11882
2025-12-16,"The Week in Vulnerabilities: Cyble Tracks New ICS Threats, Zero-Days, and Active Exploitation",https://cyble.com/blog/critical-ics-and-it-vulnerabilities-tracked/,"hunting, Phish, React2shell, react, CVE-2025-6218, CVE-2025-62221, CVE-2025-55182, cve-2025-6218, cve-2025-55182, cve-2025-62221, phish",CVE-2025-6218:->https://nvd.nist.gov/vuln/detail/CVE-2025-6218 | CVE-2025-55182:->https://nvd.nist.gov/vuln/detail/CVE-2025-55182 | CVE-2025-55182->https://nvd.nist.gov/vuln/detail/CVE-2025-55182 | CVE-2025-62221:->https://nvd.nist.gov/vuln/detail/cve-2025-62221 | phishing->https://cyble.com/knowledge-hub/what-is-phishing/ | CVE-2025-55182:->https://nvd.nist.gov/vuln/detail/CVE-2025-55182 | CVE-2025-55182->https://nvd.nist.gov/vuln/detail/CVE-2025-55182
2025-12-09,"The Week in Vulnerabilities: Cyble Urges D-Link, React Server Fixes",https://cyble.com/blog/latest-it-and-ics-vulnerabilities-tracked-this-week/,"react, CVE-2025-58034, CVE-2025-64446, CVE-2025-13223, CVE-2021-26829, CVE-2025-48572, CVE-2025-48633, CVE-2021-26828, CVE-2025-55182, cve-2025-55182, cve-2021-26829, cve-2021-26828, cve-2025-13223, cve-2025-58034, cve-2025-64446","CVE-2025-55182->https://nvd.nist.gov/vuln/detail/CVE-2025-55182 | CVE-2021-26829->https://nvd.nist.gov/vuln/detail/CVE-2021-26829 | CVE-2021-26828->https://nvd.nist.gov/vuln/detail/CVE-2021-26828 | CVE-2025-13223->https://nvd.nist.gov/vuln/detail/CVE-2025-13223 | CVE-2025-58034->https://nvd.nist.gov/vuln/detail/CVE-2025-58034 | CVE-2025-64446->https://nvd.nist.gov/vuln/detail/CVE-2025-64446 | The Week in Vulnerabilities: Cyble Urges D-Link, React Server Fixes->https://cyble.com/blog/latest-it-and-ics-vulnerabilities-tracked-this-week/"
