Date,Source,Feed,Title,Link,Matched Terms
2026-04-30,RSS,https://thehackernews.com/feeds/posts/default,Google Fixes CVSS 10 Gemini CLI CI RCE and Cursor Flaws Enable Code Execution,https://thehackernews.com/2026/04/google-fixes-cvss-10-gemini-cli-ci-rce.html,NPM
2026-04-29,RSS,https://thehackernews.com/feeds/posts/default,SAP-Related npm Packages Compromised in Credential-Stealing Supply Chain Attack,https://thehackernews.com/2026/04/sap-npm-packages-compromised-by-mini.html,NPM
2026-04-29,RSS,https://thehackernews.com/feeds/posts/default,"New Wave of DPRK Attacks Uses AI-Inserted npm Malware, Fake Firms, and RATs",https://thehackernews.com/2026/04/new-wave-of-dprk-attacks-uses-ai.html,NPM
2026-04-29,RSS,https://thehackernews.com/feeds/posts/default,Webinar: How to Automate Exposure Validation to Match the Speed of AI Attacks,https://thehackernews.com/2026/04/webinar-how-to-automate-exposure.html,Phish
2026-04-29,RSS,https://thehackernews.com/feeds/posts/default,CISA Adds Actively Exploited ConnectWise and Windows Flaws to KEV,https://thehackernews.com/2026/04/cisa-adds-actively-exploited.html,CVE-2024-1708
2026-04-28,RSS,https://thehackernews.com/feeds/posts/default,After Mythos: New Playbooks For a Zero-Window Era,https://thehackernews.com/2026/04/after-mythos-new-playbooks-for-zero.html,Mythos
2026-04-28,RSS,https://thehackernews.com/feeds/posts/default,Chinese Silk Typhoon Hacker Extradited to U.S. Over COVID Research Cyberattacks,https://thehackernews.com/2026/04/chinese-silk-typhoon-hacker-extradited.html,Silk Typhoon
2026-04-28,RSS,https://thehackernews.com/feeds/posts/default,Microsoft Confirms Active Exploitation of Windows Shell CVE-2026-32202,https://thehackernews.com/2026/04/microsoft-confirms-active-exploitation.html,CVE-2026-32202
2026-04-27,RSS,https://thehackernews.com/feeds/posts/default,Mythos Changed the Math on Vulnerability Discovery. Most Teams Aren't Ready for the Remediation Side,https://thehackernews.com/2026/04/mythos-changed-math-on-vulnerability.html,Mythos
2026-04-27,RSS,https://thehackernews.com/feeds/posts/default,PhantomCore Exploits TrueConf Vulnerabilities to Breach Russian Networks,https://thehackernews.com/2026/04/phantomcore-exploits-trueconf.html,Breach
2026-04-25,RSS,https://thehackernews.com/feeds/posts/default,Researchers Uncover Pre-Stuxnet ‘fast16’ Malware Targeting Engineering Software,https://thehackernews.com/2026/04/researchers-uncover-pre-stuxnet-fast16.html,Iran
2026-04-25,RSS,https://thehackernews.com/feeds/posts/default,"CISA Adds 4 Exploited Flaws to KEV, Sets May 2026 Federal Deadline",https://thehackernews.com/2026/04/cisa-adds-4-exploited-flaws-to-kev-sets.html,CVE-2024-57726
2026-04-24,RSS,https://thehackernews.com/feeds/posts/default,"FIRESTARTER Backdoor Hit Federal Cisco Firepower Device, Survives Security Patches",https://thehackernews.com/2026/04/firestarter-backdoor-hit-federal-cisco.html,Cisco
2026-04-24,RSS,https://thehackernews.com/feeds/posts/default,NASA Employees Duped in Chinese Phishing Scheme Targeting U.S. Defense Software,https://thehackernews.com/2026/04/nasa-employees-duped-in-chinese.html,Phish
2026-04-23,RSS,https://thehackernews.com/feeds/posts/default,[Webinar] Mythos Reality Check: Beating Automated Exploitation at AI Speed,https://thehackernews.com/2026/04/webinar-mythos-reality-check-beating.html,Mythos
2026-04-23,RSS,https://thehackernews.com/feeds/posts/default,Project Glasswing Proved AI Can Find the Bugs. Who's Going to Fix Them?,https://thehackernews.com/2026/04/project-glasswing-proved-ai-can-find.html,Mythos
2026-04-23,RSS,https://thehackernews.com/feeds/posts/default,Vercel Finds More Compromised Accounts in Context.ai-Linked Breach,https://thehackernews.com/2026/04/vercel-finds-more-compromised-accounts.html,Breach
2026-04-22,RSS,https://thehackernews.com/feeds/posts/default,Self-Propagating Supply Chain Worm Hijacks npm Packages to Steal Developer Tokens,https://thehackernews.com/2026/04/self-propagating-supply-chain-worm.html,NPM
2026-04-30,RSS,https://krebsonsecurity.com/feed/,Anti-DDoS Firm Heaped Attacks on Brazilian ISPs,https://krebsonsecurity.com/2026/04/anti-ddos-firm-heaped-attacks-on-brazilian-isps/,"Breach, CVE-2023-1389, cve-2023-1389"
2026-04-21,RSS,https://krebsonsecurity.com/feed/,‘Scattered Spider’ Member ‘Tylerb’ Pleads Guilty,https://krebsonsecurity.com/2026/04/scattered-spider-member-tylerb-pleads-guilty/,"Phish, Scattered Spider, Retail, Breach"
2026-04-14,RSS,https://krebsonsecurity.com/feed/,"Patch Tuesday, April 2026 Edition",https://krebsonsecurity.com/2026/04/patch-tuesday-april-2026-edition/,"Phish, CVE-2026-5281, CVE-2026-34621, CVE-2026-32201, CVE-2026-33825, cve-2026-32201, cve-2026-33825, cve-2026-34621, cve-2026-5281"
2026-04-07,RSS,https://krebsonsecurity.com/feed/,Russia Hacked Routers to Steal Microsoft Office Tokens,https://krebsonsecurity.com/2026/04/russia-hacked-routers-to-steal-microsoft-office-tokens/,"Phish, React"
2026-04-06,RSS,https://krebsonsecurity.com/feed/,"Germany Doxes “UNKN,” Head of RU Ransomware Gangs REvil, GandCrab",https://krebsonsecurity.com/2026/04/germany-doxes-unkn-head-of-ru-ransomware-gangs-revil-gandcrab/,"Hunting, hunting"
2026-04-30,RSS,https://www.bleepingcomputer.com/feed/,"New Bluekit phishing service includes an AI assistant, 40 templates",https://www.bleepingcomputer.com/news/security/new-bluekit-phishing-service-includes-an-ai-assistant-40-templates/,Phish
2026-04-30,RSS,https://www.bleepingcomputer.com/feed/,FBI links cybercriminals to sharp surge in cargo theft attacks,https://www.bleepingcomputer.com/news/security/fbi-links-cybercriminals-to-sharp-surge-in-cargo-theft-attacks/,Canada
2026-04-30,RSS,https://www.bleepingcomputer.com/feed/,"Critical cPanel and WHM bug exploited as a zero-day, PoC now available",https://www.bleepingcomputer.com/news/security/critical-cpanel-and-whm-bug-exploited-as-a-zero-day-poc-now-available/,CVE-2026-41940
2026-04-29,RSS,https://www.bleepingcomputer.com/feed/,Official SAP npm packages compromised to steal credentials,https://www.bleepingcomputer.com/news/security/official-sap-npm-packages-compromised-to-steal-credentials/,"NPM, TeamPCP"
2026-05-01,RSS,https://helpnetsecurity.com/feed/,Open-source privacy proxy masks PII before prompts reach external AI services,https://www.helpnetsecurity.com/2026/05/01/open-source-pii-privacy-proxy/,OpenAI
2026-05-01,RSS,https://helpnetsecurity.com/feed/,New infosec products of the month: April 2026,https://www.helpnetsecurity.com/2026/05/01/new-infosec-products-of-the-month-april-2026/,"Hunting, Broadcom"
2026-04-30,RSS,https://helpnetsecurity.com/feed/,cPanel zero-day exploited for months before patch release (CVE-2026-41940),https://www.helpnetsecurity.com/2026/04/30/cpanel-zero-day-vulnerability-cve-2026-41940-exploited/,"CVE-2026-41940, cve-2026-41940"
2026-04-30,RSS,https://helpnetsecurity.com/feed/,Cisco releases open-source toolkit for verifying AI model lineage,https://www.helpnetsecurity.com/2026/04/30/cisco-ai-model-provenance-kit/,"Cisco, cisco"
2026-04-30,RSS,https://www.zdnet.com/topic/security/rss.xml,T-Mobile will give you the latest Apple Watch SE for free - how to qualify for the deal,https://www.zdnet.com/article/apple-watch-se-3-tmobile-deal/,Retail
2026-04-30,RSS,https://www.infosecurity-magazine.com/rss/news/,UK: Education Sector Faces Surge in Cyber Breaches Despite Stable National Threat Levels,https://www.infosecurity-magazine.com/news/uk-education-sector-faces-surge-in/,Breach
2026-04-29,RSS,https://www.infosecurity-magazine.com/rss/news/,Malicious npm Dependency Linked to AI Assisted Commit Targets Crypto Wallets,https://www.infosecurity-magazine.com/news/ai-npm-dependency-targets-crypto/,NPM
2026-04-29,RSS,https://www.infosecurity-magazine.com/rss/news/,Critical Flaw Turns Vect Ransomware into Data Destroying Wiper,https://www.infosecurity-magazine.com/news/critical-flaw-vect-ransomware-data/,Vect Ransomware
2026-04-28,RSS,https://www.infosecurity-magazine.com/rss/news/,Medtronic Confirms Data Breach After ShinyHunters Claims,https://www.infosecurity-magazine.com/news/medtronic-data-breach-shinyhunters/,"ShinyHunters, Breach"
2026-04-28,RSS,https://www.infosecurity-magazine.com/rss/news/,Chinese National Extradited Over Silk Typhoon Cyber Campaign,https://www.infosecurity-magazine.com/news/chinese-national-extradited-silk/,Silk Typhoon
2026-04-28,RSS,https://www.infosecurity-magazine.com/rss/news/,North Korean Hackers Target Crypto Firms with ClickFix and AI-Made Zoom Lures,https://www.infosecurity-magazine.com/news/bluenoroff-dprk-hackers-target/,"Phish, Lazarus, ClickFix"
2026-04-27,RSS,https://www.infosecurity-magazine.com/rss/news/,Researchers Identify Fast16 Sabotage Malware That Pre-Dates Stuxnet,https://www.infosecurity-magazine.com/news/fast16-sabotage-malware-winds/,Iran
2026-04-27,RSS,https://www.infosecurity-magazine.com/rss/news/,BlackFile Group Targets Retail and Hospitality with Vishing Attacks,https://www.infosecurity-magazine.com/news/blackfile-group-targets-retail/,Retail
2026-04-24,RSS,https://www.infosecurity-magazine.com/rss/news/,"UK Biobank Data Breach: Health Data of 500,000 Listed for Sale in China",https://www.infosecurity-magazine.com/news/uk-biobank-data-beach-health-data/,Breach
2026-04-24,RSS,https://www.infosecurity-magazine.com/rss/news/,Npm Supply Chain Malware Attack Targets Developers With Worm-Like Propagation,https://www.infosecurity-magazine.com/news/npm-supply-chain-worm-canister/,NPM
2026-04-22,RSS,https://www.infosecurity-magazine.com/rss/news/,Surge in Silent Subject Phishing Attacks Targets VIP Users,https://www.infosecurity-magazine.com/news/silent-subject-phishing-campaigns/,Phish
2026-04-21,RSS,https://www.infosecurity-magazine.com/rss/news/,Vercel Confirms Cyber Incident After Sophisticated Attacker Exploits Third‑Party Tool,https://www.infosecurity-magazine.com/news/vercel-cyber-incident-threat-actor/,Breach
2026-04-21,RSS,https://www.infosecurity-magazine.com/rss/news/,North Korea Blamed for $290m KelpDAO Crypto Heist,https://www.infosecurity-magazine.com/news/north-korean-blamed-290m-kelpdao/,Lazarus
2026-04-16,RSS,https://www.infosecurity-magazine.com/rss/news/,Cookeville Medical Center Notifies Patients After July 2025 Ransomware Attack,https://www.infosecurity-magazine.com/news/cookeville-medical-center-data/,Breach
2026-04-15,RSS,https://www.infosecurity-magazine.com/rss/news/,OpenAI Unveils GPT-5.4-Cyber for Improving Cyber Defense With AI,https://www.infosecurity-magazine.com/news/openai-unveils-gpt-54-cyber-defense/,"OpenAI, Mythos"
2026-04-14,RSS,https://www.infosecurity-magazine.com/rss/news/,AI Security Institute Advocates Security Best Practices After Mythos Test,https://www.infosecurity-magazine.com/news/ai-security-institute-best/,Mythos
2026-04-13,RSS,https://www.infosecurity-magazine.com/rss/news/,FBI Dismantles $20m Phishing Operation W3LL,https://www.infosecurity-magazine.com/news/fbi-dismantles-phishing-operation/,Phish
2026-04-13,RSS,https://www.infosecurity-magazine.com/rss/news/,Operation Atlantic Seizes $12m in Crypto Losses,https://www.infosecurity-magazine.com/news/operation-atlantic-seizes-12m/,"Canadian, Phish"
2026-04-10,RSS,https://www.infosecurity-magazine.com/rss/news/,Just Three Ransomware Gangs Accounted for 40% of Attacks Last Month,https://www.infosecurity-magazine.com/news/three-ransomware-gangs-40-percent/,"Akira, Qilin, DragonForce"
2026-04-09,RSS,https://www.infosecurity-magazine.com/rss/news/,Bitcoin Depot Reports $3.6m Crypto Theft After System Breach,https://www.infosecurity-magazine.com/news/bitcoin-depot-dollar36m-crypto/,Breach
2026-04-09,RSS,https://www.infosecurity-magazine.com/rss/news/,Atomic Stealer MacOS ClickFix Attack Bypasses Apple Security Warnings,https://www.infosecurity-magazine.com/news/atomic-stealer-macos-clickfix/,ClickFix
2026-04-09,RSS,https://www.infosecurity-magazine.com/rss/news/,Middle East Hack-for-Hire Operation Traced to South Asian Cyber Espionage Group,https://www.infosecurity-magazine.com/news/middle-east-hack-operation-bitter/,Phish
2026-04-08,RSS,https://www.infosecurity-magazine.com/rss/news/,Critical Vulnerability in Ninja Forms Exposes WordPress Sites,https://www.infosecurity-magazine.com/news/flaw-ninja-forms-wordpress/,Critical Vulnerability
2026-04-08,RSS,https://www.infosecurity-magazine.com/rss/news/,Anthropic Launches Project Glasswing to Use AI to Find and Fix Critical Software Vulnerabilities,https://www.infosecurity-magazine.com/news/anthropic-launch-project-glasswing/,Mythos
2026-04-08,RSS,https://www.infosecurity-magazine.com/rss/news/,Iran‑Backed Threat Actors Hit US CNI Providers via Internet‑Facing OT Assets,https://www.infosecurity-magazine.com/news/iranbacked-hackers-cni-ot-assets/,Iran
2026-04-07,RSS,https://www.infosecurity-magazine.com/rss/news/,GPU Rowhammer Attack Enables Privilege Escalation and Full System Compromise,https://www.infosecurity-magazine.com/news/gpu-based-rowhammer-attack/,Breach
2026-04-03,RSS,https://www.infosecurity-magazine.com/rss/news/,New Phishing Platform Used in Credential Theft Campaigns Against C-Suite Execs,https://www.infosecurity-magazine.com/news/new-phishing-platform-credential/,Phish
2026-04-02,RSS,https://www.infosecurity-magazine.com/rss/news/,Apple Expands iOS 18 Security Updates Amid DarkSword Threat,https://www.infosecurity-magazine.com/news/apple-ios-18-updates-darksword/,DarkSword
2026-04-02,RSS,https://www.infosecurity-magazine.com/rss/news/,Researchers Observe Sub-One-Hour Ransomware Attacks,https://www.infosecurity-magazine.com/news/researchers-subonehour-ransomware/,Akira
2026-04-21,RSS,https://us-cert.cisa.gov/ncas/alerts.xml,Defending Against China-Nexus Covert Networks of Compromised Devices,https://www.cisa.gov/news-events/cybersecurity-advisories/aa26-113a,"Canada, Canadian, IOC, Indicator of Compromise, Hunting, Cisco, cisco"
2026-04-06,RSS,https://us-cert.cisa.gov/ncas/alerts.xml,Iranian-Affiliated Cyber Actors Exploit Programmable Logic Controllers Across US Critical Infrastructure,https://www.cisa.gov/news-events/cybersecurity-advisories/aa26-097a,"IOC, Phish, Iran, CVE-2021-22681, cve-2021-22681, iran"
2026-04-30,RSS,https://securelist.com/feed/,Silver Fox uses the new ABCDoor backdoor to target organizations in Russia and India,https://securelist.com/silver-fox-tax-notification-campaign/119575/,"Phish, Retail, Tailscale, F5, f5"
2026-04-20,RSS,https://securelist.com/feed/,FakeWallet crypto stealer spreading through iOS apps in the App Store,https://securelist.com/fakewallet-cryptostealer-ios-app-store/119474/,"Phish, F5, React, f5"
2026-04-15,RSS,https://securelist.com/feed/,Threat landscape for industrial automation systems in Q4 2025,https://securelist.com/industrial-threat-report-q4-2025/119392/,"Canada, Phish"
2026-04-09,RSS,https://securelist.com/feed/,The long road to your crypto: ClipBanker and its marathon infection chain,https://securelist.com/clipbanker-malware-distributed-via-trojanized-proxifier/119341/,"Hunting, F5, f5"
2026-04-08,RSS,https://securelist.com/feed/,Financial cyberthreats in 2025 and the outlook for 2026,https://securelist.com/financial-threat-report-2025/119304/,"Phish, Retail, Breach"
2026-04-30,RSS,https://darkreading.com/rss.xml,TeamPCP Hits SAP Packages With 'Mini Shai-Hulud' Attack,https://www.darkreading.com/cloud-security/teampcp-sap-packages-mini-shai-hulud,"NPM, TeamPCP"
2026-04-30,RSS,https://darkreading.com/rss.xml,Anthropic's Mythos Has Landed: Here's What Comes Next for Cyber,https://www.darkreading.com/cybersecurity-operations/anthropic-mythos-cyber-what-comes-next,Mythos
2026-04-30,RSS,https://darkreading.com/rss.xml,Claude Mythos Fears Startle Japan's Financial Services Sector,https://www.darkreading.com/cyber-risk/claude-mythos-startle-japans-financial-sector,Mythos
2026-04-29,RSS,https://darkreading.com/rss.xml,"Vect 2.0 Ransomware Acts as Wiper, Thanks to Design Error",https://www.darkreading.com/threat-intelligence/vect-ransomware-wiper-design-error,TeamPCP
2026-04-27,RSS,https://darkreading.com/rss.xml,Parsing Agentic Offensive Security's Existential Threat,https://www.darkreading.com/cyber-risk/industrialized-exploitation-agentic-offensive-security-existential-threat,"OpenAI, Mythos"
2026-04-24,RSS,https://darkreading.com/rss.xml,AI Phishing Is No. 1 With a Bullet for Cyberattackers,https://www.darkreading.com/cyber-risk/ai-phishing-no-1-cyberattackers,Phish
2026-04-24,RSS,https://darkreading.com/rss.xml,North Korea's Lazarus Targets macOS Users via ClickFix,https://www.darkreading.com/threat-intelligence/north-koreas-lazarus-targets-macos-users-clickfix,"Lazarus, ClickFix"
2026-04-23,RSS,https://darkreading.com/rss.xml,Bad Memories Still Haunt AI Agents,https://www.darkreading.com/vulnerabilities-threats/bad-memories-haunt-ai-agents,Cisco
2026-04-21,RSS,https://darkreading.com/rss.xml,Surge in Bomgar RMM Exploitation Demonstrates Supply Chain Risk,https://www.darkreading.com/cyberattacks-data-breaches/surge-bomgar-rmm-exploitation-demonstrates-supply-chain-risk,"Bomgar, CVE-2026-1731"
2026-04-20,RSS,https://darkreading.com/rss.xml,Vercel Employee's AI Tool Access Led to Data Breach,https://www.darkreading.com/application-security/vercel-employees-ai-tool-access-data-breach,Breach
2026-04-17,RSS,https://darkreading.com/rss.xml,"Tycoon 2FA Phishers Scatter, Adopt Device Code Phishing",https://www.darkreading.com/threat-intelligence/tycoon-2fa-hackers-device-code-phishing,Phish
2026-04-16,RSS,https://darkreading.com/rss.xml,North Korea Uses ClickFix to Target macOS Users' Data,https://www.darkreading.com/application-security/north-korea-clickfix-target-macos-users-data,ClickFix
2026-04-29,RSS,https://darkwebinformer.com/rss/,"Daily Dose of Dark Web Informer - April 30th, 2026",https://darkwebinformer.com/daily-dose-of-dark-web-informer-april-30th-2026/,"IOC, F5, DarkWebInformer, ShinyHunters, Breach, darkwebinformer, breach, shinyhunters"
2026-04-29,RSS,https://darkwebinformer.com/rss/,Threat Actor 0056113 Selling Compromised Law-Enforcement Emails and EDR-as-a-Service for Fraudulent Emergency Data Requests,https://darkwebinformer.com/threat-actor-0056113-selling-compromised-law-enforcement-emails-and-edr-as-a-service-for-fraudulent-emergency-data-requests/,"IOC, DarkWebInformer, Breach"
2026-04-27,RSS,https://darkwebinformer.com/rss/,"Daily Dose of Dark Web Informer - April 27th, 2026",https://darkwebinformer.com/daily-dose-of-dark-web-informer-april-27th-2026/,"IOC, F5, React, React2Shell, DarkWebInformer, Breach, darkwebinformer, breach, react, react2shell"
2026-04-27,RSS,https://darkwebinformer.com/rss/,"LCBO (Liquor Control Board of Ontario) Database Breached: 165,840 Customer Records Exposed from Ontario's Crown Corporation",https://darkwebinformer.com/lcbo-liquor-control-board-of-ontario-database-breached-165-840-customer-records-exposed-from-ontarios-crown-corporation/,"Canada, Canadian, IOC, Phish, Retail, DarkWebInformer, Breach"
2026-04-27,RSS,https://darkwebinformer.com/rss/,"Den kulturelle skolesekken (DKS) Database Breached: 1,389,534 Records Exposed from Norway's National Cultural-Schoolbag Programme",https://darkwebinformer.com/den-kulturelle-skolesekken-dks-database-breached-1-389-534-records-exposed-from-norways-national-cultural-schoolbag-programme/,"IOC, DarkWebInformer, Breach"
2026-04-23,RSS,https://darkwebinformer.com/rss/,Arkansas State Crime Lab Database Breached: Threat Actor kittykatkrew Leaks Court Calendars and Law Enforcement Personnel Directory,https://darkwebinformer.com/arkansas-state-crime-lab-database-breached-threat-actor-kittykatkrew-leaks-court-calendars-and-law-enforcement-personnel-directory/,"IOC, DarkWebInformer, Breach"
2026-04-21,RSS,https://darkwebinformer.com/rss/,"Ledil Immobilier (ledil.immo) Database Breached: Threat Actor 888 Leaks 6,700 French Real Estate User Records",https://darkwebinformer.com/ledil-immobilier-ledil-immo-database-breached-threat-actor-888-leaks-6-700-french-real-estate-user-records/,"IOC, DarkWebInformer, Breach"
2026-04-20,RSS,https://darkwebinformer.com/rss/,"Daily Dose of Dark Web Informer - April 20th, 2026",https://darkwebinformer.com/daily-dose-of-dark-web-informer-april-20th-2026/,"IOC, Scattered Spider, Qilin, Everest, F5, DarkWebInformer, Breach, darkwebinformer, breach, scattered spider, everest, qilin"
2026-04-20,RSS,https://darkwebinformer.com/rss/,Taiseer (taiseer.co) Database Breached: Threat Actor Sorb Offering PII of Egyptian Gold Investors for Sale,https://darkwebinformer.com/taiseer-taiseer-co-database-breached-threat-actor-sorb-offering-pii-of-egyptian-gold-investors-for-sale/,"IOC, DarkWebInformer, Breach"
2026-04-20,RSS,https://darkwebinformer.com/rss/,"Chartered Institute of Bankers of Nigeria (CIBN) Database Breached: 250GB Including Member PII, Source Code, and ID Documents Leaked",https://darkwebinformer.com/chartered-institute-of-bankers-of-nigeria-cibn-database-breached-250gb-including-member-pii-source-code-and-id-documents-leaked/,"IOC, DarkWebInformer, Breach"
2026-04-17,RSS,https://darkwebinformer.com/rss/,"Global Dining Event Diner en Blanc Breached, 411K Guest Records With Event Details and Invite Codes Listed for Sale",https://darkwebinformer.com/global-dining-event-diner-en-blanc-breached-411k-guest-records-with-event-details-and-invite-codes-listed-for-sale/,"Canada, IOC, DarkWebInformer, Breach, darkwebinformer"
2026-04-17,RSS,https://darkwebinformer.com/rss/,CVE-2026-34197: 13-Year-Old Apache ActiveMQ RCE via Jolokia API Surfaces for In-the-Wild Attacks,https://darkwebinformer.com/cve-2026-34197-13-year-old-apache-activemq-rce-via-jolokia-api-surfaces-for-in-the-wild-attacks/,"CVE-2023-46604, CVE-2026-34197, cve-2026-34197"
2026-04-29,RSS,https://news.sophos.com/en-us/feed,'Mini Shai-Hulud' supply chain attack targets SAP npm packages,https://www.sophos.com/en-us/blog/-mini-shai-hulud-supply-chain-attack-targets-sap-npm-packages,NPM
2026-04-29,RSS,https://hackread.com/feed,New AI-Powered Bluekit Phishing Kit Targets Major Platforms with MFA Bypass Attacks,https://hackread.com/bluekit-phishing-kit-targets-platforms-mfa-bypass-attack/,Phish
2026-04-29,RSS,https://hackread.com/feed,Polymarket Rejects Data Breach Claims as Hacker Alleges 300K Records Stolen,https://hackread.com/polymarket-rejects-data-breach-hacker-records-stolen/,Breach
2026-04-30,RSS,https://cyble.com/feed,"The Week in Vulnerabilities: GitHub Enterprise, Argo CD, Oracle Identity Manager, and Mozilla Security Flaws",https://cyble.com/blog/weekly-vulnerability-insights-active-exploits/,"Hunting, Phish, Cisco, CVE-2023-27351, CVE-2025-48700, CVE-2026-20133, CVE-2026-33825, hunting, phish"
2026-04-29,RSS,https://cyble.com/feed,How Cyble Blaze AI Turns Billions of Threat Signals into Actionable Intelligence,https://cyble.com/blog/cyble-blaze-ai-cyber-threat-intelligence-automation/,"IOC, Phish, React"
2026-04-28,RSS,https://cyble.com/feed,ANZ Organizations Are in the Ransomware Crosshairs— What the Dark Web Is Telling Us,https://cyble.com/blog/anz-ransomware-threats-dark-web-intelligence/,"Hunting, Phish, Akira, Qilin, DragonForce, Retail, Breach"
2026-04-27,RSS,https://cyble.com/feed,Why U.S. Critical Infrastructure Is the Highest-Value Target in the Global Cyber War,https://cyble.com/blog/critical-infrastructure-cyberattack-threats-2026/,"Atmosphere, Hunting, React, Breach, hunting"
2026-04-24,RSS,https://cyble.com/feed,Operation TrustTrap: Anatomy of a Large-Scale Deceptive Domain Spoofing Campaign,https://cyble.com/blog/operation-trusttrap-domain-spoofing-campaign/,"IOC, Hunting, Phish, React, phish, hunting"
2026-04-24,RSS,https://cyble.com/feed,"The Week in Vulnerabilities: SharePoint, Fortinet, OpenClaw, and GPL Odorizers",https://cyble.com/blog/cyble-weekly-vulnerability-report-apr-23/,"Phish, Critical Vulnerability, CVE-2026-1340, CVE-2026-21643, CVE-2026-32201, cve-2026-21643"
2026-04-23,RSS,https://cyble.com/feed,Why AI Cybersecurity Is No Longer Optional for Australian Organizations: Moving from Reactive to Predictive Defense,https://cyble.com/blog/australia-ai-cybersecurity-predictive-defense/,"Phish, React, Breach, phish, breach, react"
2026-04-22,RSS,https://cyble.com/feed,Why Indian Enterprises Are a Prime Target for Dark Web Credential Markets,https://cyble.com/blog/dark-web-credential-markets-india-enterprise-risk/,"Phish, React, Breach"
2026-04-20,RSS,https://cyble.com/feed,"Threat Landscape March 2026: Ransomware Dominance, Access Brokers, Data Leaks, and Critical Exploitation Trends",https://cyble.com/blog/monthly-threat-landscape-march-2026/,"Cisco, Akira, Qilin, DragonForce, Retail, F5, NPM, Breach, Iran, CVE-2021-22681, CVE-2026-20131, CVE-2026-33017, CVE-2025-53521, CVE-2026-20963, breach, qilin, akira, cve-2026-20131"
2026-04-17,RSS,https://cyble.com/feed,Four Nationally Significant Cyberattacks Every Week — Is the UK Ready?,https://cyble.com/blog/uk-cyberattacks-ncsc-report/,Breach
2026-05-01,RSS,https://csoonline.com/feed,Human-centric failures: Why BEC continues to work despite MFA,https://www.csoonline.com/article/4165638/human-centric-failures-why-bec-continues-to-work-despite-mfa.html,"Phish, phish"
2026-05-01,RSS,https://csoonline.com/feed,Just 34% of cyber pros plan to stick with their current employer,https://www.csoonline.com/article/4165916/just-34-of-cyber-pros-plan-to-stick-with-their-current-employer.html,React
2026-05-01,RSS,https://csoonline.com/feed,4 ways to prepare your SOC for agentic AI,https://www.csoonline.com/article/4140208/4-ways-to-prepare-your-soc-for-agentic-ai.html,IOC
2026-05-01,RSS,https://csoonline.com/feed,‘Trivial’ exploit can give attackers root access to Linux kernel,https://www.csoonline.com/article/4165824/trivial-exploit-can-give-attackers-root-access-to-linux-kernel.html,"Canadian, CVE-2016-5195, CVE-2022-0847"
