Date,Title,Link,Matched Terms,Inline Links
2025-12-31,Flashpoint Weekly Vulnerability Insights and Prioritization Report,https://flashpoint.io/blog/flashpoint-weekly-vulnerability-insights-prioritization/,"critical Vulnerability, CVE-2024-40890, CVE-2024-40891, CVE-2024-55591, CVE-2025-0108, CVE-2025-10035, CVE-2025-20333, CVE-2025-22224, CVE-2025-22457, CVE-2025-23006, CVE-2025-24085, CVE-2025-24201, CVE-2025-24472, CVE-2025-24990, CVE-2025-25181, CVE-2025-27363, CVE-2025-2746, CVE-2025-2783, CVE-2025-31201, CVE-2025-31324, CVE-2025-32433, CVE-2025-3248, CVE-2025-33053, CVE-2025-41244, CVE-2025-42599, CVE-2025-43200, CVE-2025-43300, CVE-2025-53770, CVE-2025-5419, CVE-2025-54309, CVE-2025-57819, CVE-2025-59230, CVE-2025-61882, CVE-2025-61884, CVE-2025-61932, CVE-2025-64446, CVE-2025-6543, CVE-2025-6558, CVE-2025-7775, CVE-2025-8876, CVE-2025-62221, CVE-2025-14174, CVE-2025-43529, CVE-2025-55182, CVE-2025-59718, CVE-2025-14847, cve-2025-14847, cve-2024-55591, cve-2025-23006, cve-2025-24085, cve-2024-40890, cve-2024-40891, cve-2025-25181, cve-2025-0108, cve-2025-24472, cve-2025-22224, cve-2025-24201, cve-2025-27363, cve-2025-2746, cve-2025-2783, cve-2025-22457, cve-2025-3248, cve-2025-32433, cve-2025-31201, cve-2025-31324, cve-2025-42599, cve-2025-5419, cve-2025-33053, cve-2025-43200, cve-2025-6543, cve-2025-6558, cve-2025-54309, cve-2025-53770, cve-2025-8876, cve-2025-43300, cve-2025-7775, cve-2025-57819, cve-2025-10035, cve-2025-20333, cve-2025-41244, cve-2025-61882, cve-2025-59230, cve-2025-24990, cve-2025-61884, cve-2025-61932, cve-2025-64446, cve-2025-55182, cve-2025-14174, cve-2025-43529, cve-2025-59718, cve-2025-62221",CVE-2025-14847->https://app.flashpoint.io/vuln/vulnerabilities/431689 | CVE-2024-55591->https://app.flashpoint.io/vuln/vulnerabilities/387268 | CVE-2025-23006->https://app.flashpoint.io/vuln/vulnerabilities/388931 | CVE-2025-24085->https://app.flashpoint.io/vuln/vulnerabilities/389331 | CVE-2024-40890->https://app.flashpoint.io/vuln/vulnerabilities/389567 | CVE-2024-40891->https://app.flashpoint.io/vuln/vulnerabilities/389561 | CVE-2025-25181->https://app.flashpoint.io/vuln/vulnerabilities/390273 | CVE-2024-40890->https://app.flashpoint.io/vuln/vulnerabilities/390663 | CVE-2024-40891->https://app.flashpoint.io/vuln/vulnerabilities/390819 | CVE-2025-0108->https://app.flashpoint.io/vuln/vulnerabilities/391412 | CVE-2025-24472->https://app.flashpoint.io/vuln/vulnerabilities/391163 | CVE-2025-22224->https://app.flashpoint.io/vuln/vulnerabilities/393505 | CVE-2025-24201->https://app.flashpoint.io/vuln/vulnerabilities/394375 | CVE-2025-27363->https://app.flashpoint.io/vuln/vulnerabilities/394630 | CVE-2025-2746->https://app.flashpoint.io/vuln/vulnerabilities/395138 | CVE-2025-2783->https://app.flashpoint.io/vuln/vulnerabilities/395060 | CVE-2025-22457->https://app.flashpoint.io/vuln/vulnerabilities/397614 | CVE-2025-3248->https://app.flashpoint.io/vuln/vulnerabilities/398847 | CVE-2025-32433->https://app.flashpoint.io/vuln/vulnerabilities/400177 | CVE-2025-31201->https://app.flashpoint.io/vuln/vulnerabilities/399976 | CVE-2025-31324->https://app.flashpoint.io/vuln/vulnerabilities/401512 | CVE-2025-42599->https://app.flashpoint.io/vuln/vulnerabilities/400344 | CVE-2025-5419->https://app.flashpoint.io/vuln/vulnerabilities/406274 | CVE-2025-33053->https://app.flashpoint.io/vuln/vulnerabilities/407581 | CVE-2025-43200->https://app.flashpoint.io/vuln/vulnerabilities/407778 | CVE-2025-6543->https://app.flashpoint.io/vuln/vulnerabilities/409209 | CVE-2025-6558->https://app.flashpoint.io/vuln/vulnerabilities/411784 | CVE-2025-54309->https://app.flashpoint.io/vuln/vulnerabilities/412353 | CVE-2025-53770->https://app.flashpoint.io/vuln/vulnerabilities/412291 | CVE-2025-8876->https://app.flashpoint.io/vuln/vulnerabilities/415036 | CVE-2025-43300->https://app.flashpoint.io/vuln/vulnerabilities/416051 | CVE-2025-7775->https://app.flashpoint.io/vuln/vulnerabilities/416576 | CVE-2025-57819->https://app.flashpoint.io/vuln/vulnerabilities/416936 | CVE-2025-10035->https://app.flashpoint.io/vuln/vulnerabilities/419950 | CVE-2025-20333->https://app.flashpoint.io/vuln/vulnerabilities/420800 | CVE-2025-41244->https://app.flashpoint.io/vuln/vulnerabilities/421209 | CVE-2025-61882->https://app.flashpoint.io/vuln/vulnerabilities/421926 | CVE-2025-59230->https://app.flashpoint.io/vuln/vulnerabilities/423097 | CVE-2025-24990->https://app.flashpoint.io/vuln/vulnerabilities/423096 | CVE-2025-61884->https://app.flashpoint.io/vuln/vulnerabilities/422968 | CVE-2025-61932->https://app.flashpoint.io/vuln/vulnerabilities/424186 | CVE-2025-64446->https://app.flashpoint.io/vuln/vulnerabilities/427044 | CVE-2025-55182->https://app.flashpoint.io/vuln/vulnerabilities/428930 | CVE-2025-14174->https://app.flashpoint.io/vuln/vulnerabilities/430233 | CVE-2025-43529->https://app.flashpoint.io/vuln/vulnerabilities/430498 | CVE-2025-59718->https://app.flashpoint.io/vuln/vulnerabilities/429863 | CVE-2025-62221->https://app.flashpoint.io/vuln/vulnerabilities/429825
2025-12-16,The CTI Analyst’s Isolated Arsenal: Desktop Tools for High-Risk Intelligence,https://flashpoint.io/blog/cti-analyst-desktop-tools/,"IOC, indicator of compromise",
2025-12-10,Beyond the Malware: Inside the Digital Empire of a North Korean Threat Actor,https://flashpoint.io/blog/beyond-the-malware-digital-empire-north-korean-threat-actor/,IOC,
2026-01-08,PTS Goldkist Industries Sdn Bhd By qilin,https://www.ransomlook.io//group/qilin,qilin,
2026-01-08,The Cressi By qilin,https://www.ransomlook.io//group/qilin,qilin,
2026-01-08,Telstar-Hommel By qilin,https://www.ransomlook.io//group/qilin,qilin,
2026-01-07,Evergreen Printing By qilin,https://www.ransomlook.io//group/qilin,qilin,
2026-01-07,Sortimage By qilin,https://www.ransomlook.io//group/qilin,qilin,
2026-01-07,Labeltex Group By akira,https://www.ransomlook.io//group/akira,akira,
2026-01-07,BUHLMANN GROUP By akira,https://www.ransomlook.io//group/akira,akira,
2026-01-07,Commercial Paving By qilin,https://www.ransomlook.io//group/qilin,qilin,
2026-01-07,Wilson Smith CochranDickerson By akira,https://www.ransomlook.io//group/akira,akira,
2026-01-07,RJS By akira,https://www.ransomlook.io//group/akira,akira,
2026-01-07,Morgan Records Management By everest,https://www.ransomlook.io//group/everest,Everest,
2026-01-06,Berkmann Wine Cellars By qilin,https://www.ransomlook.io//group/qilin,qilin,
2026-01-06,USArt By qilin,https://www.ransomlook.io//group/qilin,qilin,
2026-01-06,Secorp Industries By qilin,https://www.ransomlook.io//group/qilin,qilin,
2026-01-06,Medical Asset Management By qilin,https://www.ransomlook.io//group/qilin,qilin,
2026-01-06,Health Bridge Chiropractic By qilin,https://www.ransomlook.io//group/qilin,qilin,
2026-01-07,"A phishing campaign with QR codes rendered using an HTML table, (Wed, Jan 7th)",https://isc.sans.edu/diary/rss/32606,Phish,
2025-12-17,"There's Payloads, And Then There's pAIloads: A Look At Selected Opportunistic (And Possibly AI-""Enhanced"") React2Shell Probes and Attacks",https://www.greynoise.io/blog/react2shell-payload-analysis,"React2shell, react",
2026-01-06,Desjardins data breach: Quebec suspect arrested in Spain,https://databreaches.net/2026/01/06/desjardins-data-breach-quebec-suspect-arrested-in-spain/?pk_campaign=feed&pk_kwd=desjardins-data-breach-quebec-suspect-arrested-in-spain,Canada,
